"표현","expression; representation","","느낌이나 생각 등을 말, 글, 몸짓 등으로 나타내어 겉으로 드러냄.",""
"표현되다","be expressed; be represented; be manifested","","느낌이나 생각 등이 말, 글, 몸짓 등으로 나타내어져 겉으로 드러내어지다.",""
"표현력","ability to express","","느낌이나 생각 등을 말, 글, 몸짓 등으로 나타내어 겉으로 드러내는 능력.",""
"표현법","expression; way of expression","","느낌이나 생각 등을 말, 글, 몸짓 등으로 나타내어 겉으로 드러내는 방법.",""
"표현하다","express; represent; manifest","","느낌이나 생각 등을 말, 글, 몸짓 등으로 나타내어 겉으로 드러내다.",""
"푯말","post; signpost","","어떤 것을 표시하기 위해 세운 말뚝.",""
"푸근하다","cozy; snug; soft","","꽤 두꺼운 물건이나 자리가 부드럽고 따뜻하다.",""
"푸근히","cozily; snugly; softly","","꽤 두꺼운 물건이나 자리가 부드럽고 따뜻하게.",""
"푸념","complaining; grumbling","","마음속에 있는 불평을 늘어놓음. 또는 그런 말.",""
"푸념하다","complain; grumble","","마음속에 있는 불평을 늘어놓다.",""
"푸다","draw from; scoop up; ladle","","속에 들어 있는 액체, 가루, 곡식 등을 떠내어 밖으로 나오게 하다.",""
"푸닥거리","pudakgeori","","간단하게 음식을 차려 놓고 불길한 일이나 나쁜 귀신을 쫓기 위해 무당이 하는 굿.",""
"푸닥거리하다","pudakgeorihada","","간단하게 음식을 차려 놓고 무당이 굿을 하여 불길한 일이나 나쁜 귀신을 쫓다.",""
"푸대접","poor treatment","","정성을 쏟지 않고 아무렇게나 하는 대접.",""
"푸대접하다","treat poorly","","정성을 쏟지 않고 아무렇게나 대접을 하다.",""
"푸드덕","with a flap; with a flutter","","큰 새가 힘차게 날개를 치는 소리. 또는 그 모양.",""
"푸드덕거리다","keep flapping; keep fluttering","","큰 새가 힘차게 계속해서 날개를 치다.",""
"푸드덕대다","keep flapping; keep fluttering","","큰 새가 힘차게 계속해서 날개를 치다.",""
"푸드덕푸드덕","with flaps; with flutters","","큰 새가 계속해서 힘차게 날개를 치는 소리. 또는 그 모양.",""
"푸드덕푸드덕하다","keep flapping; keep fluttering","","큰 새가 계속해서 힘차게 날개를 치다.",""
"푸드덕하다","flap; flutter","","큰 새가 힘차게 날개를 치다.",""
"푸들푸들","tremblingly; quiveringly","","몸을 자꾸 크게 부르르 떠는 모양.",""
"푸들푸들하다","tremble; shiver","","몸이 자꾸 크게 부르르 떨리다. 또는 몸을 자꾸 크게 부르르 떨다.",""
"푸르다","blue; green","","맑은 가을 하늘이나 깊은 바다, 싱싱한 풀의 빛깔과 같이 밝고 선명하다.",""
"푸르뎅뎅하다","unevenly bluish","","고르지 않게 조금 푸르다.",""
"푸르르","tremblingly; quiveringly","","크고 가볍게 떠는 모양.",""
"푸르무레하다","somewhat bluish","","진하지 않게 조금 푸르다.",""
"푸르스레하다","bluish","","조금 푸르다.",""
"푸르스름하다","bluish","","조금 푸르다.",""
"푸르죽죽하다","somberly bluish","","칙칙하고 고르지 않게 조금 푸르다.",""
"푸른빛","blue light; green light","","맑은 하늘이나 깊은 바다, 풀의 빛깔과 같이 맑고 선명한 빛.",""
"푸른색","blue color; green color","","맑은 하늘이나 깊은 바다, 풀의 빛깔과 같이 맑고 선명한 색.",""
"푸릇푸릇","in a bluish color","","군데군데가 조금 푸른 모양.",""
"푸릇푸릇하다","bluish","","군데군데가 조금 푸르다.",""
"푸석푸석","swollen skin","","살이 핏기가 없이 부어오른 듯하고 윤기가 없이 거친 모양.",""
"푸석푸석하다","swollen","","살이 핏기가 없이 부어오른 듯하고 윤기가 없이 거칠다.",""
"푸석하다","swollen","","살이 핏기가 없이 조금 부어오른 듯하고 윤기가 없이 거칠다.",""
"푸성귀","greens; vegetables","","사람이 가꾸거나 저절로 자라난 온갖 채소와 나물.",""
"푸시시","untidily","","머리카락이나 털 등이 어지럽게 일어나거나 흐트러져 있는 모양.",""
"푸에르토리코","Puerto Rico","","카리브해의 서인도 제도 동쪽에 있는 섬나라. 미국 자치령이며 주요 생산물로는 사탕수수 등이 있다. 주요 언어는 에스파냐어와 영어이고 수도는 산후안이다.",""
"푸줏간","butcher's shop","","(옛날에) 쇠고기나 돼지고기 등의 고기를 팔던 가게.",""
"푸지다","abundant; plentiful","","매우 많아서 넉넉하다.",""
"푸짐하다","plentiful; abundant; generous","","마음이 흐뭇하도록 넉넉하다.",""
"푸짐히","plentifully; abundantly; generously","","마음이 흐뭇하도록 넉넉하게.",""
"푹","soundly","","잠이 깊이 들거나 피곤한 몸을 충분히 편하게 쉬는 모양.",""
"푹신","softly","","조금 푸근하게 부드럽고 탄력이 있는 느낌.",""
"푹신푹신","softly; comfortably","","매우 푸근하게 부드럽고 탄력이 있는 느낌.",""
"푹신푹신하다","soft; snug; comfortable","","매우 푸근하게 부드럽고 탄력이 있다.",""
"푹신하다","soft; spongy; pillowy","","조금 푸근하게 부드럽고 탄력이 있다.",""
"푹푹","enough; well","","충분히 익을 정도로 몹시 끓이거나 삶는 모양.",""
"푹하다","unreasonably warm; mild","","겨울 날씨가 꽤 따뜻하다.",""
"푼","pun","","(옛날에) 엽전을 세던 단위.",""
"푼돈","small change","","많지 않은 돈.",""
"푼수","situation; state","","상태나 형편.",""
"푼푼이","penny by penny","","한 푼씩 한 푼씩.",""
"풀기","being well-starched","","옷이나 천 따위에 밴 풀의 빳빳한 기운.",""
"풀꽃","grass flower","","풀에 피는 꽃.",""
"풀려나다","be released; be freed","","억눌려 있던 상태에서 벗어나 자유로운 상태가 되다.",""
"풀려나오다","be released; be freed","","억눌려 있던 상태에서 벗어나 자유로운 상태가 되어서 나오다.",""
"풀리다","be untied","","묶이거나 감기거나 얽히거나 합쳐지거나 싸인 것 등이 도로 원래의 상태가 되다.",""
"풀밭","grass; meadow","","풀이 많이 난 땅.",""
"풀벌레","grass bug","","풀숲에서 사는 벌레.",""
"풀빛","grass green","","풀의 빛깔과 같은 진한 연둣빛.",""
"풀빵","pulppang; in-cast baked bread","","모양이 새겨진 틀에 묽은 밀가루 반죽과 팥소 등을 넣어 구운 빵.",""
"풀뿌리","grass roots","","풀의 뿌리.",""
"풀숲","thicket; bush; grassland","","풀이 무성하게 자란 곳.",""
"풀썩","in a mass","","연기나 먼지 등 조금씩 뭉쳐 갑자기 한 번 일어나는 모양.",""
"풀어내다","untie","","매이거나 묶이거나 얽힌 것을 끌러 내다.",""
"풀어놓다","send; dispatch","","어떤 목적을 이루려고 사람을 널리 모으다.",""
"풀어쓰다","disjoin a syllable","","한글의 글자 모양을 풀어서 초성, 중성, 종성의 차례대로 늘어놓아 쓰다.",""
"풀어지다","be untied","","매이거나 묶이거나 얽힌 것이 원래의 상태로 되다.",""
"풀어헤치다","speak frankly","","속마음을 막힘없이 털어놓다.",""
"풀이","explanation; interpretation","","모르거나 어려운 것을 알기 쉽게 밝혀 말하는 일.",""
"풀이되다","be explained; be interpreted","","모르거나 어려운 것이 알기 쉽게 밝혀져 말하여지다.",""
"풀이하다","explain; interpret","","모르거나 어려운 것을 알기 쉽게 밝혀 말하다.",""
"풀잎","grass leaf; blade","","풀의 잎.",""
"풀쩍풀쩍","suddenly","","문을 자꾸 갑자기 열거나 닫는 모양.",""
"풀칠","gluing; pasting","","종이 등을 붙이려고 무엇에 풀을 바르는 일.",""
"풀칠하다","paste; glue; apply glue","","종이 등을 붙이려고 무엇에 풀을 바르다.",""
"풀포기","plant","","한 뿌리에서 나온 풀의 덩이.",""
"풀풀","thickly","","눈이나 먼지나 연기 등이 몹시 흩날리는 모양.",""
"풀피리","reed pipe; grass pipe","","두 입술 사이에 풀잎을 대거나 물고 부는 것.",""
"품","attitude","","말이나 행동에서 드러나는 태도나 됨됨이.",""
"품","chest width","","윗옷의 겨드랑이 밑의 가슴과 등을 두르는 부분의 넓이.",""
"품","efforts; resources; labor","","어떤 일에 드는 힘이나 수고.",""
"품값","wage; pay","","일을 한 대가로 주거나 받는 돈이나 물건.",""
"품격","character","","사람의 타고난 성품.",""
"품귀","scarcity; shortage of supply","","물건을 구하기 어려움.",""
"품다","embrace; brood; incubate","","품속에 넣거나 가슴에 대어 안다.",""
"품명","name of goods","","물품의 이름.",""
"품목","list of items","","물품의 이름을 순서대로 쓴 것.",""
"품사","part of speech","","단어를 기능, 형태, 의미에 따라 나눈 갈래.",""
"품삯","wage; pay","","일을 한 대가로 주거나 받는 돈이나 물건.",""
"품성","dignity and character","","품격과 성질.",""
"품성","nature; disposition","","타고난 성격이나 성질.",""
"품속","bosom; breast","","품의 속.",""
"품앗이","pumasi","","힘든 일을 서로 거들어 주기 위해 돌아가며 하는 일.",""
"품앗이하다","pumasihada","","힘든 일을 서로 거들어 주기 위해 돌아가며 일을 하다.",""
"품위","dignity","","사람이 갖추어야 할 위엄이나 기품.",""
"품절","being sold-out","","물건이 다 팔리고 없음.",""
"품절되다","be sold out","","물건이 다 팔리고 없게 되다.",""
"품종","kind; type","","물품의 종류.",""
"품질","quality","","물건의 성질과 바탕.",""
"품팔이","day labor","","품삯을 받고 남의 일을 해 주는 일.",""
"품평","evaluation; comment","","물건이나 작품의 좋고 나쁨을 평가함.",""
"품평하다","evaluate; comment","","물건이나 작품의 좋고 나쁨을 평가하다.",""
"품평회","product show; fair; exhibition","","물건이나 작품의 좋고 나쁨을 평가하는 모임.",""
"품행","conduct; behavior; demeanor","","품성과 행실.",""
"풋","with laughter","","갑자기 짧게 웃음을 터뜨리는 소리.",""
"풋감","green persimmon; unripe persimmon","","아직 덜 익어 푸른 감.",""
"풋고추","green chilli pepper","","아직 익지 않은 푸른 고추.",""
"풋과일","upripe fruit","","아직 덜 익은 과일.",""
"풋김치","putgimchi; putkimchi","","봄과 가을에 새로 나온 열무나 어린 배추로 담근 김치.",""
"풋나물","young herbs","","봄에 새로 난 나무나 풀의 연한 싹으로 만든 나물.",""
"풋내기","newbie; novice","","경험이 없거나 나이가 어려서 일에 서투른 사람.",""
"풋사랑","puppy love","","나이가 어려서 서툰 사랑.",""
"풋잠","catnap; light sleep; doze","","깊이 들지 못한 잠.",""
"풋풋하다","fresh; unripe; inexperienced","","생기가 있고 싱그럽다.",""
"풍","look; image","","사람에게서 느껴지는 분위기나 멋.",""
"풍경","scenery; scene; view","","자연이나 지역의 아름다운 모습.",""
"풍경화","landscape","","자연의 경치를 그린 그림.",""
"풍광","scenery; scene; view","","자연이나 지역의 아름다운 모습.",""
"풍금","harmonium; reed organ","","페달을 밟아서 바람을 넣어 소리를 내는 건반 악기.",""
"풍기","public morals","","풍속, 습관, 도덕에 관한 규율. 특히 남녀 교제에 있어서의 규율.",""
"풍기다","smell; give off","","냄새가 나다. 또는 냄새를 퍼뜨리다.",""
"풍년","bumper year; rich year","","농사가 잘되어 다른 때보다 수확이 많은 해.",""
"풍덩","with a plop","","크고 무거운 물체가 깊은 물에 떨어지거나 빠질 때 한 번 나는 소리.",""
"풍덩풍덩","with plops","","크고 무거운 물체가 깊은 물에 계속해서 떨어지거나 빠질 때 나는 소리.",""
"풍뎅이","gold beetle; goldbug","","몸이 딱딱하고 둥글넓적하며, 금빛 광택이 나는 짙은 녹색이나 보라색인 곤충.",""
"풍랑","wind and waves","","바람과 물결.",""
"풍력","wind velocity","","바람의 세기.",""
"풍류","fun with grace; tasteful leisure","","멋스럽게 즐기는 일. 또는 그렇게 노는 일.",""
"풍류객","person of taste","","멋스럽게 즐기거나 노는 사람.",""
"풍만하다","full; abundant","","매우 넉넉하여 그득하다.",""
"풍모","look; appearance","","풍채와 용모.",""
"풍문","rumor; hearsay","","바람처럼 떠도는 소문.",""
"풍물","scenery; scene; view","","자연이나 지역의 아름다운 모습.",""
"풍물놀이","pungmulnori","","농촌에서 함께 일할 때나 명절 때 흥을 돋우기 위해 연주하는 음악.",""
"풍미","flavor; savor","","음식의 고급스러운 맛.",""
"풍미하다","overwhelm; dominate","","어떤 사회 현상이나 사상 등이 널리 사회에 퍼지다.",""
"풍부하다","rich; abundant","","넉넉하고 많다.",""
"풍부히","richly; abundantly","","넉넉하고 많게.",""
"풍비박산","being scattered in all directions","","여러 곳으로 날아 흩어짐.",""
"풍상","hardship","","(비유적으로) 세상의 어려움과 고생.",""
"풍선","balloon","","커다란 주머니에 수소나 헬륨 등의 공기보다 가벼운 기체를 넣어, 공중에 높이 올라가도록 만든 물건.",""
"풍성","abundance; plentifulness; ampleness","","넉넉하고 많음. 또는 그런 느낌.",""
"풍성하다","abundant; plentiful; ample","","넉넉하고 많다.",""
"풍성히","abundantly; plentifully; amply","","넉넉하고 많이.",""
"풍속","custom","","사회에 속한 사람들에게 옛날부터 전해 오는 생활 습관.",""
"풍속","wind velocity","","바람의 속도.",""
"풍속계","anemometer; wind gauge","","바람의 세기를 재는 기계.",""
"풍속도","genre painting","","당시 사회의 풍속을 그린 그림.",""
"풍속화","genre painting","","당시의 풍속을 그린 그림.",""
"풍수","feng-shui","","집이나 무덤 등의 위치와 지형이 좋고 나쁜 것과 사람의 행복이나 불행이 밀접한 관계를 가진다는 학설.",""
"풍수지리","feng-shui","","지형이나 위치를 인간의 행복과 불행에 연결시켜 집을 짓거나 죽은 사람을 묻는 데 알맞은 장소를 구하는 이론.",""
"풍습","manners and customs","","풍속과 습관.",""
"풍악","pung-ak","","옛날부터 전해 오는 한국 고유의 음악.",""
"풍요","being rich; being abundant","","매우 많아서 넉넉함.",""
"풍요롭다","rich; abundant","","매우 많아서 넉넉함이 있다.",""
"풍요하다","rich; abundant","","매우 많아서 넉넉함이 있다.",""
"풍운","winds and clouds","","바람과 구름.",""
"풍운아","lucky adventurer; spirited fellow","","좋은 때를 타고 활동하여 세상에 이름을 날리고 큰 활약을 하는 사람.",""
"풍월","wind and moon","","맑은 바람과 밝은 달.",""
"풍자","satire; innuendo","","남의 부족한 점을 다른 것에 빗대어 비웃으면서 폭로하고 공격함.",""
"풍자성","satire; sarcasm","","풍자의 성격을 지닌 특성.",""
"풍자적","being satirical; being sarcastic","","풍자의 성격을 띤 것.",""
"풍자적","satirical; sarcastic","","풍자의 성격을 띤.",""
"풍자하다","satirize; innuendo","","남의 부족한 점을 다른 것에 빗대어 비웃으면서 폭로하고 공격하다.",""
"풍작","bumper crop; good harvest; good crop","","농사가 잘되어 다른 때보다 수확이 많은 일. 또는 그렇게 지은 농사.",""
"풍전등화","a flame before the wind","","(비유적으로) 바람 앞의 등불이라는 뜻으로, 사물이 매우 위험한 처지에 놓여 있음.",""
"풍조","stream; drift","","바람과 바닷물. 또는 바람에 따라 흐르는 바닷물.",""
"풍족하다","abundant; plentiful; rich","","매우 넉넉해서 부족함이 없다.",""
"풍족히","abundantly; plentifully; richly","","매우 넉넉해서 부족함이 없이.",""
"풍진","German measles; rubella","","주로 어린이들이 많이 걸리며, 붉은색 뾰루지가 온몸에 퍼졌다가 3~4일 만에 낫는 전염병.",""
"풍차","windmill","","바람의 힘으로 날개를 회전시켜 생기는 힘을 이용하는 장치.",""
"풍채","appearance; physique","","사람의 체격이나 드러나 보이는 사람의 겉모양.",""
"풍취","beautiful scenery","","멋스러운 느낌이 있는 풍경.",""
"풍토","climate; natural features","","어떤 지역의 기후와 토지의 상태.",""
"풍토병","endemic disease","","어떤 지역의 특수한 기후나 땅, 환경 등으로 인해 생기는 병.",""
"풍파","wind and wave","","세찬 바람과 험한 물결.",""
"풍해","wind hazard; wind damage","","바람으로 인한 피해.",""
"풍향","wind direction","","바람이 불어오는 방향.",""
"풍향계","weather vane; weathercock","","바람이 부는 방향을 관찰하여 측정하는 기구.",""
"풍화","weathering; aeration","","지구 표면에 있는 암석이 햇빛, 공기, 물, 생물 등의 작용으로 조금씩 깨지고 부서지는 일.",""
"풍화되다","be weathered","","지구 표면에 있는 암석이 햇빛, 공기, 물, 생물 등의 작용으로 조금씩 깨지고 부서지다.",""
"풍화하다","weather","","지구 표면에 있는 암석이 햇빛, 공기, 물, 생물 등의 작용으로 조금씩 깨지고 부서지다.",""
"퓨전","fusion","","서로 다른 두 종류 이상의 것을 섞어 새롭게 만든 것.",""
"퓨즈","fuse","","전선이나 전기 기구에 정해진 것보다 센 전류가 흐르면 녹아서 끊어지며 전기를 차단하도록, 납과 주석의 합금이나 아연 등으로 만든 부품.",""
"프라이","frying; fried food; fries","","음식을 기름에 지지거나 튀기는 일. 또는 그렇게 만든 음식.",""
"프라이드","pride","","자신의 가치나 능력, 소유물, 행동 등에 대한 만족에서 오는 자존심.",""
"프라이드치킨","fried chicken","","닭고기에 밀가루, 소금, 후추 등을 묻혀 기름에 튀긴 요리.",""
"프라이버시","privacy","","개인이나 집안의 사적인 일. 또는 그것을 남에게 간섭받지 않을 권리.",""
"프라이팬","frying pan","","음식을 기름에 지지거나 튀기는 데 쓰는, 손잡이가 달리고 높이가 낮으며 넓적한 냄비.",""
"프락치","spy","","특수한 임무를 수행하기 위하여 신분을 속이고 어떤 단체에 들어가서 몰래 활동하는 사람.",""
"프랑스","France","","서유럽에 있는 나라. 유럽에서 손꼽히는 농업 생산국이며 관광 산업이 발달하였다. 주요 언어는 프랑스어이고 수도는 파리이다.",""
"프랑스어","French","","주로 프랑스 사람들이 쓰는 언어.",""
"프런트","front desk","","호텔이나 식당 현관에서 고객을 안내하거나 계산을 하는 곳.",""
"프렌치토스트","French toast","","식빵 조각을 달걀, 우유, 설탕을 섞은 것에 담갔다가 살짝 구워 낸 음식.",""
"프렌치프라이","French fries","","감자를 가늘게 썰어 튀긴 요리.",""
"프로","professional; specialist","","어떤 일에 지식이나 기술을 갖추고 그 일을 전문으로 하는 사람.",""
"프로","program; show; list of programs","","라디오나 텔레비전 등에서 시간별로 나뉘어 방송되는 내용. 또는 그 차례나 목록.",""
"프로그래밍","programming","","컴퓨터를 사용하여 문제를 풀거나 컴퓨터에 작업을 처리하도록 시키기 위하여 필요한 절차를 컴퓨터가 이해할 수 있는 언어로 작성하는 일.",""
"프로그램","program; list of shows","","어떤 행사의 진행 계획이나 순서를 적은 목록. 또는 그 행사의 세부 항목.",""
"프로덕션","production","","영화나 드라마, 텔레비전의 프로그램 등을 만드는 회사.",""
"프로듀서","producer","","영화, 연극, 방송 등에서 기획과 제작에 관한 모든 것을 책임지는 사람.",""
"프로세서","processor","","컴퓨터에서 명령을 읽고 데이터를 처리하는 중앙 처리 장치.",""
"프로젝트","project","","연구나 사업. 또는 그 계획.",""
"프로판","propane","","가정용이나 자동차 등의 연료가 되고, 상온에서 압력을 가하면 쉽게 액체로 변하는 무색의 기체.",""
"프로펠러","propeller","","비행기나 배에서 엔진이 회전하는 힘을 앞으로 나아가는 힘으로 바꾸는 장치.",""
"프로필","profile","","한 사람의 간단한 이력.",""
"프롤레타리아","proletariat; working class","","자본주의 사회에서, 재산이 없고 육체노동이나 정신노동을 하여 생활하는 사람.",""
"프리랜서","freelancer","","일정한 소속이 없이 자유롭게 일하는 사람.",""
"프리미엄","premium","","정해진 가격, 급료 등에 얼마를 더하여 주는 금액.",""
"프리즘","prism","","빛을 굴절시키거나 분산시킬 때 쓰는, 유리 또는 수정 등으로 만든 세모 기둥 모양의 기구.",""
"프린터","printer","","인쇄하는 데 쓰는 기계.",""
"프린트","printing; printed material","","인쇄를 하는 일. 또는 그런 인쇄물.",""
"프린트되다","be printed","","인쇄가 되다.",""
"프린트하다","print","","인쇄를 하다.",""
"플라스틱","plastic","","열이나 압력을 가해 쉽게 모양을 만들 수 있는 물질.",""
"플라타너스","plane tree; sycamore","","잎이 활짝 편 손바닥 모양이고 가을에 작고 동그란 열매가 열리는, 가로수로 많이 심는 나무.",""
"플랑크톤","plankton","","물속에 살면서 물결에 따라 떠다니는 작은 생물.",""
"플래시","flashlight","","가지고 다닐 수 있는 작은 전등.",""
"플래카드","placard; banner","","선전하는 글이나 주장하여 외치는 글 등을 적어 높이 들거나 달아 놓거나 드리운 천.",""
"플랫폼","platform","","역에서 기차를 타고 내리는 곳.",""
"플러그","electric plug","","전기 회로를 잇거나 끊을 수 있도록 전선의 끝에 달린 장치.",""
"플러스","plus; help; boost","","이익이나 도움.",""
"플러스되다","contribute; help","","이익이나 도움이 되다.",""
"플러스하다","contribute; help","","이익이 되게 하거나 도움을 주다.",""
"플레이","play","","운동 경기에서, 선수들이 펼치는 경기 내용이나 기술적인 재주.",""
"플롯","plot","","문학 작품 등에서 이야기를 이루는 여러 요소를 결합하여 전체적인 통일을 꾀하는 일.",""
"플루트","flute","","옆으로 쥐고 구멍에 입김을 불어넣어 소리를 내는, 서양 관악기 가운데 음역이 가장 높은 목관 악기.",""
"피격","being attacked suddenly","","갑자기 누군가에게 맞거나 총, 대포, 미사일 등의 공격을 받음.",""
"피격되다","be attacked suddenly","","갑자기 누군가에게게 맞게 되거나 총, 대포, 미사일 등의 공격을 받게 되다.",""
"피격하다","attack suddenly","","갑자기 누군가에게 맞게 하거나 총, 대포, 미사일 등의 공격을 받게 하다.",""
"피고","the accused; defendant","","개인 간의 권리나 이익 문제 등에 대한 재판에서 소송을 당한 사람.",""
"피고름","bloody pus","","상처에서 피가 섞여 나오는 고름.",""
"피고인","the accused","","범죄를 저질렀을 가능성이 있어 검사의 공소에 의해 재판을 받는 사람.",""
"피곤","tiredness; exhaustion; fatigue","","몸이나 마음이 지쳐서 힘듦.",""
"피골","skin and bones","","살가죽과 뼈.",""
"피구","dodge ball","","두 편으로 나뉘어서, 일정한 구역 안에 있는 편을 그 바깥을 둘러싼 편이 공을 던져 맞히는 놀이.",""
"피나다","be desperate; endure difficulties","","몹시 고생을 하거나 힘들여서 하다.",""
"피난","taking refuge; evacuation; flight","","전쟁, 자연재해 등의 재난을 피해 멀리 도망감.",""
"피난길","route of refuge","","전쟁, 자연재해 등의 재난을 피해 도망가는 길.",""
"피난민","refugee; evacuee","","전쟁, 자연재해 등의 재난을 피해 도망가는 사람.",""
"피난살이","refugee life","","전쟁, 자연재해 등의 재난을 피해 도망가서 하는 생활.",""
"피난지","a place of refuge; shelter; asylum; haven","","전쟁, 자연재해 등의 재난을 피해 도망간 지역.",""
"피난처","shelter; hiding place","","전쟁, 자연재해 등의 재난을 피해 도망가서 머무는 곳.",""
"피난하다","take refuge; be evacuated; flee","","전쟁, 자연재해 등의 재난을 피해 멀리 도망가다.",""
"피날레","finale","","몇 개의 부분으로 구성된 연극, 음악, 경기 등에서 마지막 부분.",""
"피눈물","tears of blood","","몹시 슬프고 분해서 나는 눈물.",""
"피다","bloom; blossom","","꽃봉오리나 잎 등이 벌어지다.",""
"피동","passiveness","","스스로 움직이지 않고 남의 힘에 의해 움직임.",""
"피동문","passive sentence","","남의 힘에 의해 움직이는 동작을 나타내는 동사가 서술어로 쓰인 문장.",""
"피동적","being passive","","스스로 움직이지 않고 남의 힘에 의해 움직이는 것.",""
"피동적","passive","","스스로 움직이지 않고 남의 힘에 의해 움직이는.",""
"피둥피둥","plumply; fatly","","보기에 좋지 않을 정도로 살이 쪄서 퉁퉁한 모양.",""
