"투","manner; fashion","","말이나 글, 행동 등에서 버릇처럼 굳어지거나 특별하게 나타나는 방식.",""
"투계","cockfight","","닭을 싸우게 하여 승부를 겨룸. 또는 그런 놀이.",""
"투고","unsolicited submission; unsolicited contribution","","집필 의뢰를 받지 않은 사람이 신문이나 잡지 등에 실어 달라고 원고를 써서 보냄. 또는 그 원고.",""
"투고되다","be submitted without being solicited","","집필 의뢰를 받지 않은 사람으로부터 신문이나 잡지 등에 실어 달라는 원고가 쓰여 보내어지다.",""
"투고란","reader’s column page","","신문이나 잡지 등에서 독자가 써서 보낸 글을 싣는 지면.",""
"투고하다","submit something without being solicited","","집필 의뢰를 받지 않은 사람이 신문이나 잡지 등에 실어 달라고 원고를 써서 보내다.",""
"투과","penetration; going through","","빛, 액체, 소리 등이 물질을 뚫고 통과함.",""
"투과되다","be penetrated; being gone through","","빛, 액체, 소리 등이 물질을 뚫고 통과하게 되다.",""
"투과하다","penetrate; go through","","빛, 액체, 소리 등이 물질을 뚫고 통과하다.",""
"투구","helmet; headpiece","","(옛날에) 군인이 싸울 때에 머리를 보호하기 위해 쓰던 쇠로 만든 모자.",""
"투구","throwing a ball; pitching; thrown ball","","야구나 볼링 등에서 공을 던짐. 또는 그 공.",""
"투기","jealousy","","부부나 애인 사이에서 상대방이 다른 사람을 좋아할 경우에 지나치게 미워하고 싫어함.",""
"투기","speculation","","가격 변화로 생기는 이익을 얻기 위해 돈을 투자하거나 물건을 사고파는 일.",""
"투기꾼","speculator","","가격 변화로 생기는 이익을 얻기 위해 돈을 투자하거나 물건을 사고파는 일을 직업으로 하는 사람.",""
"투기성","being speculative","","가격 변화로 생기는 이익을 얻기 위해 돈을 투자하거나 물건을 사고파는 일을 하는 성질.",""
"투기하다","speculate","","가격 변화로 생기는 이익을 얻기 위해 돈을 투자하거나 물건을 사고팔다.",""
"투덜거리다","grumble","","남이 알아듣기 어려울 정도로 작고 낮은 목소리로 자꾸 불평을 하다.",""
"투덜투덜","grumblingly","","남이 알아듣기 어려울 정도로 작고 낮은 목소리로 자꾸 불평을 하는 모양.",""
"투덜투덜하다","grumble","","남이 알아듣기 어려울 정도로 작고 낮은 목소리로 자꾸 불평을 하다.",""
"투두둑","pitter patter","","우박이나 빗방울 등이 바닥이나 나뭇잎 위에 세게 떨어지는 소리.",""
"투망","casting a net","","물고기를 잡으려고 그물을 물속에 던져 침.",""
"투매","sacrifice sale; dumping","","손해를 무릅쓰고 주식이나 채권을 싼값에 팔아 버리는 일.",""
"투매하다","sell at a loss; dump","","손해를 무릅쓰고 주식이나 채권을 싼값에 팔아 버리다.",""
"투명","clarity","","물이나 유리 등이 맑음.",""
"투명하다","clear","","물이나 유리 등이 맑다.",""
"투박스럽다","crude; coarse","","모양이 거칠고 볼품없는 데가 있다.",""
"투박하다","crude; coarse","","생긴 모양이 볼품없이 둔하고 튼튼하기만 하다.",""
"투병","fighting against a disease","","병을 고치려는 의지를 가지고 병과 싸움.",""
"투병하다","fight against a disease","","병을 고치려는 의지를 가지고 병과 싸우다.",""
"투사","fighter","","싸움터나 경기장에서 싸우는 사람.",""
"투사","projection","","빛이 물체를 꿰뚫고 들어감.",""
"투사","shooting; throwing","","창이나 대포알 등을 내던지거나 쏨.",""
"투사기","projector","","영상을 확대하여 스크린에 비추어 주는 기계.",""
"투사되다","be shot; be thrown","","창이나 대포알 등이 내던져지거나 쏘아지다.",""
"투사하다","project","","빛이 물체를 꿰뚫고 들어가다.",""
"투사하다","shoot; throw","","창이나 대포알 등을 내던지거나 쏘다.",""
"투서","sending an anonymous letter; anonymous letter","","드러나지 않은 사실이나 남의 잘못을 고발하기 위해 어떤 기관이나 대상에게 글을 써서 몰래 보내는 일. 또는 그런 글.",""
"투서하다","send an anonymous letter","","드러나지 않은 사실이나 남의 잘못을 고발하기 위해 어떤 기관이나 대상에게 글을 써서 몰래 보내다.",""
"투석","stone-throwing; thrown stone","","돌을 던짐. 또는 그 돌.",""
"투수","pitcher","","야구에서, 상대편의 타자가 칠 공을 포수를 향해 던지는 선수.",""
"투숙","stay; being lodged","","여관, 호텔 등의 숙박 시설에서 묵음.",""
"투숙객","guest; lodger","","여관, 호텔 등의 숙박 시설에서 묵는 사람.",""
"투숙하다","stay; be lodged","","여관, 호텔 등의 숙박 시설에서 묵다.",""
"투시","seeing through; penetration","","막힌 물체를 꿰뚫어 봄.",""
"투시되다","be seen through; be penetrated","","막힌 물체가 꿰뚫어져 보이다.",""
"투시하다","see through; penetrate","","막힌 물체를 꿰뚫어 보다.",""
"투신","devotion; dedication","","어떤 일이나 직업, 분야 등에 온갖 정열을 다해 마음을 쏟음.",""
"투신하다","devote oneself to; dedicate oneself to","","어떤 일이나 직업, 분야 등에 온갖 정열을 다해 마음을 쏟다.",""
"투약","administering a dose; injection","","약을 지어 주거나 주사로 놓음.",""
"투약구","pharmacist office; medicine window","","약국이나 병원 등에서 약을 지어 내주는 곳.",""
"투약되다","be prescribed; be dosed; be injected","","약이 지어져 주어지거나 주사로 놓이다.",""
"투약하다","administer a dose to a patient; administer a dose; inject","","약을 지어 주거나 주사로 놓다.",""
"투여","dosage; medication","","약 등을 어떤 사람에게 먹이거나 주사함.",""
"투여하다","give medicine; medicate","","약 등을 어떤 사람에게 먹이거나 주사하다.",""
"투영","projection; reflection","","물체의 그림자를 어떤 물체 위에 비추는 일. 또는 그 비친 그림자.",""
"투영하다","project; reflect","","물체의 그림자를 어떤 물체 위에 비추다.",""
"투옥","imprisonment","","감옥에 가둠.",""
"투옥되다","be imprisoned; be jailed; be confined","","감옥에 가두어지다.",""
"투옥하다","imprison; jail; confine","","감옥에 가두다.",""
"투우","bullfighting; fighting bull","","소와 소를 싸우게 하는 경기. 또는 그 소.",""
"투우사","bullfighter; matador","","투우 경기에서 소와 싸우는 사람.",""
"투입","throwing in; inserting","","던져 넣음.",""
"투입구","slot; drop","","돈이나 물건 등을 넣는 구멍.",""
"투입되다","be thrown in; be inserted","","던져져 넣어지다.",""
"투입하다","throw in; insert","","던져 넣다.",""
"투자","investment","","이익을 얻기 위해 어떤 일이나 사업에 돈을 대거나 시간이나 정성을 쏟음.",""
"투자가","investor","","이익을 얻기 위해 어떤 일이나 사업에 돈을 대거나 시간이나 정성을 쏟는 사람.",""
"투자되다","be invested","","이익을 얻기 위해 어떤 일이나 사업에 돈이 대어지거나 시간이나 정성이 쏟아지다.",""
"투자액","investment; amount of investment","","이익을 얻기 위해 어떤 일이나 사업에 대려고 하거나 댄 금액.",""
"투자자","investor","","이익을 얻기 위해 어떤 일이나 사업에 돈을 대거나 시간이나 정성을 쏟는 사람.",""
"투자하다","invest","","이익을 얻기 위해 어떤 일이나 사업에 돈을 대거나 시간이나 정성을 쏟다.",""
"투쟁","fight","","어떤 대상을 이기기 위한 싸움.",""
"투쟁하다","fight","","어떤 대상을 이기기 위해 싸우다.",""
"투정","complaining; grumbling; growling","","무엇이 모자라거나 마음에 들지 않아 떼를 쓰며 조르는 일.",""
"투정하다","complain; grumble; growl","","무엇이 모자라거나 마음에 들지 않아 떼를 쓰며 조르다.",""
"투지","combative spirit; fight","","싸우고자 하는 강하고 단단한 마음.",""
"투지력","combative spirit; fight","","싸우고자 하는 의지나 힘.",""
"투척","throwing","","물건 등을 던짐.",""
"투척하다","throw","","물건 등을 던지다.",""
"투철하다","thorough","","일의 이치에 밝고 정확하다.",""
"투표","vote; ballot; poll","","선거를 하거나 어떤 일을 결정할 때 정해진 용지에 의견을 표시하여 내는 일.",""
"투표권","the right to vote","","투표할 수 있는 권리.",""
"투표소","polling place","","투표를 하는 장소.",""
"투표용지","ballot; ballot paper","","투표를 하는 데에 쓰는 일정한 양식의 종이.",""
"투표율","voter turnout","","투표할 수 있는 사람 전체에 대한 실제 투표한 사람의 비율.",""
"투표일","voting day; polling day","","투표하는 날.",""
"투표자","voter","","투표하는 사람.",""
"투표장","polling place","","투표를 하는 장소.",""
"투표지","ballot; ballot paper","","투표를 하는 데에 쓰는 일정한 양식의 종이.",""
"투표하다","vote; cast a ballot","","선거를 하거나 어떤 일을 결정할 때 정해진 용지에 의견을 표시하여 내다.",""
"투표함","ballot box","","선거를 하거나 어떤 일을 결정할 때 정해진 용지에 의견을 표시하여 내는 상자.",""
"투피스","two-piece suit; suit-dress","","윗옷과 아래옷이 같은 천으로 만들어져 한 벌을 이룬 여자 겉옷.",""
"투하","drop; airdrop","","던져서 아래로 떨어뜨림.",""
"투하되다","be dropped; be airdropped","","던져져서 아래로 떨어지다.",""
"투하하다","drop; airdrop","","던져서 아래로 떨어뜨리다.",""
"투항","surrender","","적에게 항복함.",""
"투항하다","surrender","","적에게 항복하다.",""
"투혼","fighting spirit","","끝까지 싸우려는 씩씩한 정신.",""
"툭","pop","","갑자기 튀거나 터지는 소리. 또는 그 모양.",""
"툭툭","pop-pop","","자꾸 튀거나 터지는 소리. 또는 그 모양.",""
"툭툭하다","thick; close-woven","","천 등이 단단한 실로 촘촘하게 짜이거나 솜을 많이 넣어서 두껍다.",""
"툭하면","easily; readily","","조금이라도 일이나 기회가 있기만 하면 바로.",""
"툴툴","grumpily","","마음에 들지 않아서 몹시 불평하는 모양.",""
"툴툴거리다","grumble; complain","","마음에 들지 않아서 계속 몹시 불평을 하다.",""
"툴툴대다","grumble; complain","","마음에 들지 않아서 계속 몹시 불평을 하다.",""
"툴툴하다","grumble; complain","","마음에 들지 않아서 몹시 불평을 하다.",""
"퉁","with a thump","","큰북이나 속이 빈 나무통 등을 두드려 울리는 소리.",""
"퉁겨지다","be dislocated","","버티어 놓거나 잘 짜인 물건이 크게 어긋나서 틀어지거나 빠져 나오다.",""
"퉁기다","reject","","다른 사람의 요구나 의견 등을 거절하다.",""
"퉁명","being blunt; being curt","","마음에 들지 않아서 말이나 태도가 무뚝뚝함.",""
"퉁명스럽다","blunt; curt","","마음에 들지 않아서 말이나 태도에 무뚝뚝한 데가 있다.",""
"퉁명하다","blunt; curt","","마음에 들지 않아서 말이나 태도가 무뚝뚝하다.",""
"퉁소","tungso","","대나무로 만들었고 앞에는 다섯 개, 뒤에는 한 개의 구멍이 있으며 세로로 내려 부는 악기.",""
"퉁퉁","fatly; corpulently","","살이 쪄서 몸이 옆으로 퍼진 모양.",""
"퉁퉁","with a thump","","큰북이나 속이 빈 나무통 등을 계속 두드려 울리는 소리.",""
"퉁퉁하다","fat; corpulent","","살이 쪄서 몸이 옆으로 퍼진 듯하다.",""
"퉤","spit","","침이나 입 안에 든 것을 뱉는 소리. 또는 그 모양.",""
"퉤퉤","spit","","침이나 입 안에 든 것을 자꾸 뱉는 소리. 또는 그 모양.",""
"튀각","twigak","","다시마나 대나무의 어린싹 등을 잘라 기름에 튀긴 반찬.",""
"튀기","hybrid; cross","","종이 다른 두 동물 사이에서 태어난 동물.",""
"튀기다","flick; pluck","","힘을 모았다가 갑자기 탁 놓아서 뻗거나 튀게 하다.",""
"튀기다","fry","","끓는 기름에 넣어서 부풀게 하다.",""
"튀김","fried food","","생선이나 고기, 야채 등을 밀가루에 묻혀서 기름에 튀긴 음식.",""
"튀김옷","batter","","녹말가루나 밀가루로 입힌 튀김의 겉 부분.",""
"튀니지","Tunisia","","북아프리카 지중해 연안에 있는 나라. 국토의 약 절반 정도는 사하라 사막에 속해 있으며 주민 대부분은 이슬람교도이다. 공용어는 아랍어이고 수도는 튀니스이다.",""
"튀다","bounce","","용수철이나 공과 같은 물체가 솟아오르다.",""
"튀어나오다","protrude","","겉으로 툭 내밀어져 나오다.",""
"튕기다","bounce","","다른 물체에 부딪치거나 힘을 받아서 튀어 나오다.",""
"튜바","tuba","","3개에서 5개의 밸브를 갖는 큰 나팔 모양으로 무겁고 낮은 소리를 내는 금관 악기.",""
"튜브","tube","","약이나 치약, 물감 등을 넣고 짜내어 쓰는 용기.",""
"튤립","tulip","","봄에 흰색, 노란색, 자주색 등의 넓은 잎이 종 모양으로 어긋나게 피는 꽃.",""
"트다","be chapped","","너무 마르거나 추워서 틈이 생기고 갈라지다.",""
"트다","clear; open","","막혀 있던 것을 치우고 통하게 하다.",""
"트라이앵글","triangle","","철로 된 봉을 정삼각형으로 구부려 한쪽 끝을 실로 매달고 막대로 두드리는 악기.",""
"트랙","track","","육상 경기장이나 경마장에서 사람이나 말이 달리는 길.",""
"트랜스","transformer","","전압을 높이거나 낮추는 장치.",""
"트랩","ramp; traps; gangway","","배나 비행기를 타고 내릴 때 쓰는 사다리.",""
"트럭","truck","","물건을 실어 나르는 자동차.",""
"트럼펫","trumpet","","폭이 좁은 원통 모양의 관으로 되어 있어 높고 날카로운 소리를 내는 금관 악기.",""
"트럼프","trump; trump card","","다이아몬드, 클로버, 하트, 스페이드 무늬가 그려진 카드로 하는 서양식 카드놀이. 또는 그 카드.",""
"트렁크","trunk; travel bag","","여행할 때 쓰는 큰 가방.",""
"트레이닝","training","","주로 몸의 힘을 기르기 위해 하는 운동.",""
"트레이드","trade-off","","프로 팀 사이에서 선수를 다른 팀으로 옮기거나 서로 바꾸는 일.",""
"트레일러","trailer","","견인차에 연결하여 짐이나 사람을 실어 나르는 차.",""
"트렌치코트","trench coat","","목깃에서 소매가 통째로 이어져 있고 어깨에 덮개가 있으며 허리에 벨트가 있는, 물이 새지 않도록 막는 외투.",""
"트로이카","troika","","세 마리의 말이 끄는 러시아 특유의 썰매나 마차.",""
"트로트","teuroteu","","일정한 형식의 리듬을 갖고 있으며, 구성지거나 슬픈 느낌을 주는 노래.",""
"트로피","trophy","","상을 탄 것을 기념하기 위해 주는 컵이나 깃발 등의 물건.",""
"트롬본","trombone","","'U'자 모양의 관 두 개를 맞추어 만든, 관을 뽑거나 당겨 음을 조절하는 금관 악기.",""
"트리오","trio","","세 사람이 각 성부를 맡아서 함께 화음을 맞추어 노래를 부르거나 연주하는 것. 또는 그 노래나 연주.",""
"트림","burp; belching; eructation","","먹은 음식이 잘 소화되지 않아서 생긴 가스가 입으로 나옴. 또는 그 가스.",""
"트림하다","burp; belch; eruct","","먹은 음식이 잘 소화되지 않아서 생긴 가스가 입으로 나오다.",""
"트이다","get cleared","","막혀 있던 것이 치워지고 통하게 되다.",""
"트집","fault; hole","","아무 이유 없이 작은 흠을 들추어내어 불평을 하거나 말썽을 부림. 또는 그 불평이나 말썽.",""
"특강","special lecture","","정규 과정 이외에 특별히 하는 강의.",""
"특검","special prosecutor","","‘특별 검사’를 줄여 이르는 말.",""
"특공대","special forces","","적을 갑자기 공격하기 위해 특별히 만들어 훈련한 부대.",""
"특권","privilege","","특별한 권리.",""
"특권층","privileged class","","사회적으로 특별한 권리를 누리는 신분이나 계급.",""
"특근","working overtime; extra duty","","정해진 시간 외에 특별히 더 일함. 또는 그렇게 하는 일.",""
"특급","special class; special rank; special grade","","특별한 계급이나 등급.",""
"특급","special express","","‘특별 급행’을 줄여 이르는 말.",""
"특기","special comment","","특별히 다루어 기록함. 또는 그 기록.",""
"특기","specialty; one's skill","","남이 가지지 못한 특별한 기술이나 재능.",""
"특기생","talented student","","어떤 분야에 특별한 기술이나 재능이 있다고 인정받아 입학하는 학생.",""
"특기하다","leave a special comment","","특별히 다루어 기록하다.",""
"특단","being special","","보통과 차이가 나게 다름.",""
"특등","special grade; special class","","특별히 높은 등급. 또는 일 등보다 높은 등급.",""
"특례","exception; special case","","보통과 다른 특별한 예.",""
"특례법","special law","","특정한 지역, 사람, 사물 등에 한정하여 적용하는 법.",""
"특명","special order","","보통과 다른 특별한 명령.",""
"특무","special duty; special mission","","보통과 다르게 특별히 맡거나 맡겨진 일.",""
"특별","being special","","보통과 차이가 나게 다름.",""
"특별나다","distinctive; special","","보통의 것과 아주 다르다.",""
"특별법","special law","","특정한 지역, 사람, 사물 등에 한정하여 적용하는 법.",""
"특별시","teukbyeol-si","","정부가 직접 관리하고 감독하는, 등급이 가장 높은 행정 단위.",""
"특별하다","special","","보통과 차이가 나게 다르다.",""
"특별히","specially; particularly; especially","","보통과 차이가 나게 다르게.",""
"특보","special report; news flash","","특별히 대중 매체를 통하여 새로운 소식을 알림. 또는 그 소식.",""
"특사","envoy; special envoy","","특별한 임무를 받아 외국으로 보내지는 사람.",""
"특사","special amnesty; special pardon","","‘특별 사면’을 줄여 이르는 말.",""
"특산","specialty; regional product","","어떤 지역에서 특별히 남. 또는 그 물건.",""
"특산물","specialty; regional product","","어떤 지역에서 특별히 생산되는 물건.",""
"특산품","specialty; regional product","","어떤 지역에서 특별히 생산되는 물품.",""
"특색","distinct characteristic; peculiarity; feature","","보통의 것과 차이가 나게 다른 점.",""
"특석","special seat; VIP seat; first-class seat","","특별히 마련한 좌석.",""
"특선","special selection; specially-selected thing","","특별히 골라서 뽑음. 또는 그런 것.",""
"특설","special installation; special arrangement","","특별히 설치함.",""
"특성","characteristic; trait; feature","","일정한 사물에만 있는 보통과 매우 차이가 나게 다른 성질.",""
"특수","being unusual; being unique; being special","","보통과 매우 차이가 나게 다름.",""
"특수","special demand","","특별한 상황에서 생기는 수요.",""
"특수성","distinct characteristic; uniqueness","","일반적이고 보편적인 것과 다른 성질.",""
"특수하다","extraordinary; exceptional; special","","보통과 매우 차이가 나게 뛰어나다.",""
"특수하다","unusual; unique; special","","보통과 매우 차이가 나게 다르다.",""
"특수화","specialization; particularization","","보통과 매우 차이가 나게 다르게 됨. 또는 그렇게 되게 함.",""
"특수화되다","be specialized; be particularized","","보통과 매우 차이가 나게 다르게 되다.",""
"특수화하다","specialize; particularize","","보통과 매우 차이가 나게 다르게 되다. 또는 그렇게 되게 하다.",""
"특실","VIP room; VIP suite","","병원, 기차, 호텔 등에서 가장 좋은 방.",""
"특약","special condition","","특별한 조건을 붙인 약속.",""
"특유","uniqueness; peculiarity","","일정한 사람이나 사물만이 특별히 갖추고 있음.",""
"특유하다","unique; peculiar","","일정한 사람이나 사물만이 특별히 갖추고 있다.",""
"특이","being unusual; being unique","","보통의 것에 비해 뚜렷하게 다름.",""
"특이하다","unusual; unique","","보통의 것에 비해 뚜렷하게 다르다.",""
"특전","benefit; privilege; special favor","","특별히 베푸는 은혜나 혜택.",""
"특정","being specific; being particular","","특별히 가리켜 분명하게 정함.",""
"특정되다","be specified","","특별히 가리켜져 분명하게 정해지다.",""
"특정인","specific person","","특별히 가리켜 분명하게 정한 사람.",""
"특정하다","specified","","특별히 가리켜져 분명하게 정해져 있다.",""
"특제","being specially-made","","보통의 것보다 특별하거나 특수하게 만듦. 또는 그런 제품.",""
"특종","special type","","특별한 종류.",""
"특진","special promotion","","뛰어난 공로를 세워 특별히 계급이나 등급이 올라감.",""
"특진","special treatment; special care","","종합 병원에서 환자의 요청에 따라 특정한 의사가 진료함.",""
"특진하다","get a special promotion","","뛰어난 공로를 세워 특별히 계급이나 등급이 올라가다.",""
"특진하다","treat specially; give special care","","종합 병원에서 환자의 요청에 따라 특정한 의사가 진료하다.",""
"특질","property; peculiarity","","다른 것과는 다른 특별한 기질이나 성질.",""
"특집","special edition; special feature; special program","","신문이나 잡지, 방송 등에서 어떤 내용이나 대상을 특별히 중점을 두고 하는 편집. 또는 그런 편집물.",""
"특집극","special drama; special program","","라디오나 텔레비전에서 특별한 날이나 사건 등을 기념하기 위해 만든 극.",""
"특집호","special issue; special edition","","정기적으로 펴내는 출판물의 특집으로 발행하는 호.",""
"특징","distinct characteristic; peculiarity; feature","","다른 것에 비해 특별히 달라 눈에 띄는 점.",""
"특징적","being distinct; being peculiar","","다른 것에 비해 특별히 달라 눈에 띄는 것.",""
"특징적","distinct; peculiar","","다른 것에 비해 특별히 달라 눈에 띄는.",""
"특징짓다","characterize; mark","","어떤 사물이 가지는 특징을 밝혀 정하다.",""
"특채","special employment; special appointment","","어떤 사람을 특별히 뽑아서 씀.",""
"특채되다","be specially employed; be specially appointed","","어떤 사람이 특별히 뽑혀서 쓰이다.",""
"특채하다","employ specially; appoint specially","","어떤 사람을 특별히 뽑아서 쓰다.",""
"특출하다","outstanding; excellent","","특별히 뛰어나다.",""
"특파","special dispatch","","특별한 임무를 주어 사람을 보냄.",""
"특파되다","be specially dispatched","","특별한 임무가 주어져 사람이 보내어지다.",""
"특파원","mission; delegate","","특별한 임무를 위해 특정 지역에 보내진 사람.",""
"특파하다","dispatch specially","","특별한 임무를 주어 사람을 보내다.",""
"특허","patent","","특정한 사람에게 일정한 권리나 능력을 주는 행정 행위.",""
"특허권","patent","","발명 또는 새로운 기술적 고안을 한 사람이나 단체가 그 발명이나 기술에 관해 독점적으로 가지는 권리.",""
"특혜","favor; preferential treatment","","특별한 은혜나 혜택.",""
"특화","specialization","","한 나라의 산업 구조나 수출 분야에서 특정 산업이나 상품이 큰 비중을 차지함. 또는 그런 상태.",""
"특활","extracurricular activity","","‘특별 활동’을 줄여 이르는 말.",""
"특효","special efficacy","","어떤 병이나 증세에 특별히 좋은 효과.",""
"특효약","miracle cure; wonder drug","","어떤 병이나 증세에 특별히 효과가 좋은 약.",""
"특히","specially; particularly; especially","","보통과 다르게.",""
"튼튼하다","strong","","매우 단단하고 굳세다.",""
"튼튼히","strongly","","매우 단단하고 굳세게.",""
"틀","mold","","똑같이 생긴 물건을 여러 개 찍어 내거나 굳혀 내는 데 쓰는 도구.",""
"틀니","dentures; artificial teeth","","잇몸에 끼웠다 뺐다 할 수 있게 인공적으로 만든 이.",""
"틀다","twist","","몸이나 몸 한 부분의 방향을 꼬아 돌리다.",""
"틀리다","be twisted","","몸이나 몸 한 부분의 방향이 꼬이게 돌려지다.",""
"틀리다","be wrong; be incorrect","","계산이나 답, 사실 등이 맞지 않다.",""
"틀림없다","sure enough; invariably right; unfailing","","조금도 틀리거나 어긋나는 일이 없다.",""
"틀림없이","surely enough","","조금도 틀리거나 어긋나는 일이 없이.",""
"틀어넣다","squeeze; cram; stuff","","비좁은 자리에 억지로 들이밀어 넣다.",""
"틀어막다","fill; stuff; stop","","무엇을 억지로 들이밀어 넣어 통하지 못하게 막다.",""
