"합법","legitimacy; legality","","법과 규범에 알맞음.",""
"합법성","legitimacy; legality","","법과 규범에 알맞은 성질.",""
"합법적","being legal; being legitimate; being lawful","","법과 규범에 맞는 것.",""
"합법적","legal; legitimate; lawful","","법과 규범에 맞는.",""
"합법화","legalization; legitimization","","법과 규범에 맞도록 함.",""
"합법화되다","be legalized; be legitimized","","법과 규범에 맞도록 되다.",""
"합법화하다","legalize; legitimize","","법과 규범에 맞도록 하다.",""
"합병","merger; annexation; amalgamation","","둘 이상의 기구나 단체, 나라 등이 하나로 합쳐짐. 또는 그렇게 만듦.",""
"합병되다","be merged; be annexed; be amalgamated","","둘 이상의 기구나 단체, 나라 등이 하나로 합쳐지다.",""
"합병증","complications","","어떤 질병과 함께 생기는 다른 질병.",""
"합병하다","merge; annex; amalgamate","","둘 이상의 기구나 단체, 나라 등이 하나로 합쳐지다. 또는 그렇게 만들다.",""
"합산","total; sum total; aggregate","","둘 이상을 더하여 계산함.",""
"합산되다","be added up; be totaled; be aggregated","","둘 이상이 더하여져 계산되다.",""
"합산하다","add up; total; aggregate","","둘 이상을 더하여 계산하다.",""
"합석","sharing a table; joining","","같은 자리에 함께 앉음.",""
"합석하다","share a table; join","","같은 자리에 함께 앉다.",""
"합선","short circuit","","전류가 흐르는 두 선이 사고로 직접 맞붙는 일.",""
"합성","synthesis; compound","","둘 이상의 것을 합쳐서 하나를 이룸.",""
"합성되다","be compounded; be synthesized","","둘 이상의 것이 합쳐져서 하나로 이루어지다.",""
"합성어","compound word","","둘 이상의 실질 형태소가 붙어서 만들어진 단어.",""
"합성하다","compound; synthesize","","둘 이상의 것을 합쳐서 하나를 이루다.",""
"합세","joining forces","","흩어져 있는 힘을 한곳에 모음.",""
"합세하다","join forces; combine forces","","흩어져 있는 힘을 한곳에 모으다.",""
"합쇼체","hapsyo-che; hapsyo style","","상대 높임법의 하나로, 상대편을 아주 높이는 종결형.",""
"합숙","lodging together; staying together","","여러 사람이 한곳에서 머무름.",""
"합숙소","camp; dormitory; lodging place for a group","","여러 사람이 한데 머무르는 곳.",""
"합숙하다","lodge together; stay together","","여러 사람이 한곳에서 머무르다.",""
"합승","carpooling","","자동차 등에 여럿이 함께 탐.",""
"합승하다","carpool","","자동차 등에 여럿이 함께 타다.",""
"합심","concurrence; harmony; cooperation","","여러 사람이 마음을 하나로 모음.",""
"합심하다","unite; pull together; cooperate","","여러 사람이 마음을 하나로 모으다.",""
"합의","agreement; consensus","","서로 의견이 일치함. 또는 그 의견.",""
"합의되다","be agreed; be settled","","서로 의견이 일치되다.",""
"합의되다","be discussed; be debated; be consulted","","두 사람 이상이 한자리에 모여서 의견 등이 논해지다.",""
"합의점","agreement; common ground","","서로의 의견이 일치하는 점.",""
"합의제","consensus","","행정 기관의 의사를 여러 구성원이 합의하여 결정하는 제도.",""
"합의하다","agree; settle; reach a deal","","서로 의견이 일치하다.",""
"합의하다","discuss; consult","","두 사람 이상이 한자리에 모여서 의논하다.",""
"합일","unity; being one","","둘 이상이 합하여 하나가 됨. 또는 그렇게 만듦.",""
"합일되다","be united; be unified; be agreed","","둘 이상이 합해져 하나가 되다.",""
"합일하다","unify; unite; harmonize","","둘 이상이 합하여 하나가 되다. 또는 그렇게 만들다.",""
"합작","collaboration; joint; partnership","","어떠한 것을 만들기 위해 힘을 합함.",""
"합작품","joint work; joint effort; collaboration","","둘 이상의 사람이나 단체가 힘을 합하여 만든 작품.",""
"합작하다","collaborate; partner with","","어떠한 것을 만들기 위해 힘을 합하다.",""
"합장","putting one's hands together","","불교에서, 두 손바닥을 합하여 마음이 한결같음을 나타냄. 또는 그런 예법.",""
"합장하다","put one's hands together","","불교에서, 두 손바닥을 합하여 마음이 한결같음을 나타내다.",""
"합주","ensemble","","두 가지 이상의 악기로 동시에 연주함. 또는 그런 연주.",""
"합주곡","ensemble","","두 가지 이상의 악기로 동시에 연주하도록 작곡한 곡.",""
"합주하다","play music together; perform together","","두 가지 이상의 악기로 동시에 연주하다.",""
"합죽이","being toothless","","(낮잡아 이르는 말로) 이가 빠져서 입과 볼이 움푹 들어간 사람.",""
"합죽하다","toothless; pursed; puckered","","이가 빠져서 입과 볼이 움푹 들어가 있는 상태이다.",""
"합중국","federation","","둘 이상의 국가나 주가 독립된 법과 제도를 가지면서 하나의 주권 아래 연합한 국가 형태.",""
"합집합","union","","둘 이상의 집합이 있을 때, 각 집합의 원소 전체로 이루어진 집합.",""
"합창","choir; singing together","","여러 사람이 목소리를 맞추어 함께 노래를 부름. 또는 그 노래.",""
"합창곡","choral song; choral music","","여러 사람이 소리의 높낮이에 따라 음을 나누어 소리가 어울리게 부를 수 있도록 만든 노래.",""
"합창단","choir; chorus","","여러 사람이 소리의 높낮이에 따라 음을 나누어 소리가 어울리도록 노래를 부르기 위해 모인 단체.",""
"합창하다","sing together; sing in unison","","여러 사람이 목소리를 맞추어 함께 노래를 부르다.",""
"합치","agreement; accord","","의견, 주장, 생각 등이 서로 어긋나지 않고 정확히 맞음.",""
"합치다","combine; unite; merge","","여럿을 하나로 모으다.",""
"합치되다","be in agreement; be in accord","","의견, 주장, 생각 등이 서로 어긋나지 않고 정확히 맞게 되다.",""
"합치하다","agree with; accord with; correspond to","","의견, 주장, 생각 등이 서로 어긋나지 않고 정확히 맞다.",""
"합판","plywood; veneer","","얇고 판판하게 자른 나뭇조각을 여러 겹 붙여 만든 판.",""
"합하다","combine; put together; merge","","여럿이 한데 모이다. 또는 여럿을 한데 모으다.",""
"합헌","being constitutional","","헌법에 어긋나지 않는 일.",""
"합환주","hapwanju","","전통 결혼식에서 신랑 신부가 서로 잔을 바꾸어 마시는 술.",""
"핫도그","hot dog","","긴 빵을 세로로 갈라 소시지 등을 끼우고 버터와 겨자 소스 등을 바른 음식.",""
"핫바지","hatbaji","","안에 솜을 넣어 만든 바지.",""
"핫저고리","hatjeogori","","안에 솜을 넣어 만든 저고리.",""
"핫팬츠","hot pants","","길이가 아주 짧고 통이 좁아 몸에 꼭 맞는 바지.",""
"항","section; clause; paragraph","","내용을 체계적으로 나누어 서술하는 단위.",""
"항간","village; town","","시골 마을의 사회.",""
"항거","resistance; defiance; disobedience","","순순히 따르지 않고 맞서서 대들거나 반대함.",""
"항거하다","resist; defy; disobey","","순순히 따르지 않고 맞서서 대들거나 반대하다.",""
"항고","appeal","","법원의 결정이나 명령을 따르지 않고, 다시 재판을 요구하는 일. 또는 그런 절차.",""
"항고하다","appeal","","법원의 결정이나 명령을 따르지 않고, 다시 재판을 요구하다.",""
"항공","aviation; air","","비행기로 공중을 날아다님.",""
"항공권","airline ticket; flight ticket","","비행기에 탈 수 있는 표.",""
"항공기","airplane; aircraft; plane","","사람이나 물건을 싣고 공중을 날아다닐 수 있는 교통수단.",""
"항공로","air route; airway","","비행기가 안전하게 다닐 수 있도록 확실하게 정해져 있는 공중의 길.",""
"항공료","airfare; flight fare","","비행기 등을 이용할 때 내는 돈.",""
"항공사","airline","","비행기를 사용하여 사람을 태워 보내거나 물건을 실어 보내는 일을 하는 회사.",""
"항공편","air transportation; flight","","비행기 등을 이용하는 교통편.",""
"항구","port; harbor","","배가 드나들 수 있도록 강가나 바닷가에 만든 시설.",""
"항구성","permanency","","변하지 않고 오래가는 성질.",""
"항구적","being permanent; being eternal; being everlasting","","변하지 않고 오래가는 것.",""
"항구적","permanent; everlasting","","변하지 않고 오래가는.",""
"항균","being antibiotic; being antibacterial","","부패나 병 등을 일으키는 미생물에 저항함.",""
"항렬","generation","","같은 조상을 둔 후손들을 세대별로 구분하여 나타내는 말.",""
"항로","sea route; seaway; waterway","","배가 바다 위에서 지나다니는 길.",""
"항만","port; harbor","","바닷가가 안쪽으로 휘어 들어가서 배 등이 안전하게 머물 수 있고, 화물이나 사람이 배에서 육지로 오르내리기에 편리한 곳. 또는 그렇게 만든 곳.",""
"항목","clause; article; item","","법률이나 규정 등의 각각의 부분.",""
"항문","anus","","배설물을 몸 밖으로 내보내는 소화 기관의 가장 아래쪽에 있는 구멍.",""
"항변","counterargument; rebuttal","","다른 사람의 주장에 맞서 옳고 그름을 따짐.",""
"항변","protest; complaint","","어떤 일이 올바르지 않거나 마음에 들지 않아 반대하는 뜻을 주장함.",""
"항변하다","counterargue; rebut","","다른 사람의 주장에 맞서 옳고 그름을 따지다.",""
"항변하다","protest; complain","","어떤 일이 올바르지 않거나 마음에 들지 않아 반대하는 뜻을 주장하다.",""
"항복","surrender; submission","","적이나 상대편의 힘에 눌려 자신의 뜻을 굽히고 복종함.",""
"항복하다","surrender; yield; submit","","적이나 상대편의 힘에 눌려 자신의 뜻을 굽히고 복종하다.",""
"항상","always; all the time","","어느 때에나 변함없이.",""
"항상성","homeostasis; constancy","","늘 일정한 상태를 유지하려는 성질.",""
"항생제","antibiotic","","다른 미생물이나 생물의 세포를 선택적으로 억제하거나 죽이는 약.",""
"항성","fixed star","","보이는 위치를 바꾸지 아니하고 별자리를 구성하며, 스스로 빛을 내는 별.",""
"항소","appealing; appeal","","민사나 형사 소송에서 판결을 받아들이지 않고 다시 재판할 것을 요구함. 또는 그러한 일.",""
"항소심","appeal","","항소 사건에 대한 법원의 심사나 재판.",""
"항소하다","appeal","","민사나 형사 소송에서 판결을 받아들이지 않고 다시 재판할 것을 요구하다.",""
"항시","always; all the time; at all times","","똑같은 상태로 언제나.",""
"항시","ordinary time; normal times","","보통 때.",""
"항아리","hang-ari","","진흙을 구워 만드는, 아래와 위가 좁고 배가 동그랗게 부른 그릇.",""
"항암","being anticancer; being antitumor; being cancer-fighting","","암세포가 늘어나는 것을 억제하거나 암세포를 죽임.",""
"항암제","anticancer drug; anticancer agent","","암세포가 커지거나 늘어나는 것을 억제하는 물질이나 약.",""
"항원","antigen","","생물의 몸속에 들어가서 항체를 만들게 하는 물질.",""
"항의","protest; complaint","","어떤 일이 올바르지 않거나 마음에 들지 않아 반대하는 뜻을 주장함.",""
"항의서","letter of protest; letter of complaint; letter of claim","","어떤 일이 올바르지 않거나 마음에 들지 않아 반대하는 내용을 적은 문서.",""
"항의하다","protest; complaint","","어떤 일이 올바르지 않거나 마음에 들지 않아 반대하는 뜻을 주장하다.",""
"항일","anti-Japan; struggle against Japan","","일본 제국주의의 침략과 통치에 맞서서 싸움.",""
"항쟁","protest; struggle; resistance","","맞서 싸움.",""
"항쟁하다","protest; struggle; resist","","맞서 싸우다.",""
"항전","fighting; resistance","","적에 맞서 싸움.",""
"항체","antibody","","항원의 자극에 의해 몸속에서 만들어지는 물질.",""
"항해","voyage; sailing","","배를 타고 바다 위를 다님.",""
"항해사","navigator; mate","","선장을 도와서 배를 운항하는 데 필요한 업무를 맡아 하는 선원.",""
"항해술","navigation; seamanship","","배를 운항하는 기술.",""
"항해하다","sail; voyage; navigate","","배를 타고 바다 위를 다니다.",""
"항히스타민제","antihistamine","","항원과 항체의 반응 때문에 몸 안에 생기는 알레르기성 증상을 억제하는 약.",""
"해갈","appeasing one's thirst; quenching one's thirst","","목마름을 해결하여 없애 버림.",""
"해갈되다","(thirst) be appeased; be quenched","","목마름이 해결되어 없어지다.",""
"해갈하다","appease one's thirst; quench one's thirst","","목마름을 해결하여 없애 버리다.",""
"해감","dreg; sediment; mud","","바닷물 등에서 흙과 작고 더러운 물질이 썩어 생기는 냄새나는 찌꺼기.",""
"해감하다","remove sediment","","조개 등에 들어 있는 해감을 뱉어 내게 만들다.",""
"해거름","sunset; dusk","","해가 서쪽으로 넘어가는 일. 또는 그런 때.",""
"해거리","being biennial","","한 해를 거름. 또는 그런 간격.",""
"해결","solution; settlement","","사건이나 문제, 일 등을 잘 처리해 끝을 냄.",""
"해결되다","be solved; be settled; be resolved","","사건이나 문제, 일 등이 잘 처리되어 끝이 나다.",""
"해결사","debt collector; fixer","","처리하기 어려운 사건이나 문제, 일 등을 맡아 폭력으로 해결해 주고 돈을 받는 무리.",""
"해결책","solution; answer; fix","","사건이나 문제, 일 등을 잘 처리해 끝을 내기 위한 방법.",""
"해결하다","solve; settle; resolve; fix","","사건이나 문제, 일 등을 잘 처리해 끝을 내다.",""
"해경","maritime police; coastal guard","","바닷가를 순찰하며 치안과 환경 보전 등의 임무를 수행하는 경찰.",""
"해고","firing; dismissal","","일터에서 일하던 사람을 그만두게 하여 내보냄.",""
"해고되다","be fired; be dismissed","","일터에서 일하던 사람이 그만두게 되어 내보내지다.",""
"해고하다","dismiss; fire","","일터에서 일하던 사람을 그만두게 하여 내보내다.",""
"해골","skeleton","","죽은 사람의 살이 썩고 남은 뼈.",""
"해괴망측하다","bizarre; extremely odd; very strange","","말할 수 없을 만큼 매우 이상하다.",""
"해괴하다","very odd; extremely strange; bizarre","","크게 놀랄 정도로 매우 이상하다.",""
"해군","navy; naval force","","바다에서 임무를 수행하는 군대.",""
"해금","lifting a ban","","하지 못하게 금지하던 것을 풂.",""
"해금되다","to be lifted; to be removed","","하지 못하게 금지되던 것이 풀리다.",""
"해금하다","lift a ban","","하지 못하게 금지하던 것을 풀다.",""
"해내다","win; defeat","","상대편을 사정을 보아주지 않고 이겨 내다.",""
"해넘이","sunset","","해가 막 넘어가는 때. 또는 그런 현상.",""
"해녀","haenyeo","","바닷속에 들어가 해삼, 전복, 미역 등을 따는 일을 직업으로 하는 여자.",""
"해님","Sun","","(높이는 말로) 해를 사람처럼 비유하여 이르는 말.",""
"해답","answer; solution","","질문이나 문제를 풀이함. 또는 그런 것.",""
"해당","being relevant; being competent; being related","","무엇과 관계가 있는 바로 그것.",""
"해당되다","correspond to; be equivalent to; be tantamount to","","어떤 범위나 조건 등에 바로 들어맞게 되다.",""
"해당란","relevant field; relevant space; relevant box","","어떤 사항에 바로 들어맞는 난.",""
"해당자","relevant person","","무엇과 관계가 있는 사람.",""
"해당하다","correspond to; be equivalent to; be tantamount to","","어떤 범위나 조건 등에 바로 들어맞다.",""
"해당화","rugosa rose","","바닷가의 모래땅이나 산기슭에서 나고 피는 붉은 자주색 꽃.",""
"해독","comprehension; interpretation","","어려운 구절이나 글 등을 읽어 뜻을 이해하거나 해석함.",""
"해독","damage; harm","","좋고 올바른 것을 망치거나 손해를 끼침. 또는 그 손해.",""
"해독","detoxification","","몸 안에 들어간 독을 없앰.",""
"해독제","antidote; detoxicant","","몸 안에 들어간 독을 없애는 약.",""
"해독하다","comprehend; interpret","","어려운 구절이나 글 등을 읽어 뜻을 이해하거나 해석하다.",""
"해독하다","detoxify","","몸 안에 들어간 독을 없애다.",""
"해돋이","sunrise","","해가 막 솟아오르는 때. 또는 그런 현상.",""
"해동","unfreezing; defrosting; thaw","","얼었던 것이 녹아서 풀림. 또는 그렇게 하게 함.",""
"해동되다","be unfrozen; be defrosted; be thawed","","얼었던 것이 녹아서 풀리게 되다.",""
"해동하다","unfreeze; defrost; thaw","","얼었던 것이 녹아서 풀리다. 또는 그렇게 하게 하다.",""
"해라체","haerache","","상대 높임법의 하나로, 상대편을 아주 낮추는 뜻을 나타내는 종결형을 사용하는 높임법.",""
"해로","married couple growing old together","","부부가 평생을 같이 살며 함께 늙음.",""
"해로","sea route; seaway; waterway","","바다에서 배가 다니는 길.",""
"해로하다","grow old together","","부부가 평생을 같이 살며 함께 늙다.",""
"해롭다","harmful; bad","","이롭지 않고 해가 되는 점이 있다.",""
"해롱거리다","act the giddy goat; act the fool","","버릇없고 조심성 없이 자꾸 까불다.",""
"해롱대다","act the giddy goat; act the fool","","버릇없고 조심성 없이 자꾸 까불다.",""
"해롱해롱","frivolously","","버릇없고 조심성 없이 자꾸 까부는 모양.",""
"해롱해롱하다","act the giddy goat; act the fool","","버릇없고 조심성 없이 자꾸 까불다.",""
"해류","sea current; ocean current","","일정한 방향과 빠르기로 이동하는 바닷물의 흐름.",""
"해리","haeri","","거리의 단위.",""
"해마","sea horse","","몸길이는 8cm 정도이며 머리는 말의 머리와 비슷하고 주둥이가 대롱 모양으로 생긴 바닷물고기.",""
"해마다","every year; each year","","각각의 해에 모두.",""
"해맑다","bright; innocent; clear","","물질적인 대상이 환하게 맑다.",""
"해머","hammer","","물건을 두드리는 데 쓰는, 쇠로 된 큰 망치.",""
"해명","explanation; clarification; elucidation","","이유나 내용 등을 풀어서 밝힘.",""
"해명되다","be explained; be clarified; be elucidated","","이유나 내용 등이 풀려서 밝혀지다.",""
"해명하다","explain; clarify; elucidate","","이유나 내용 등을 풀어서 밝히다.",""
"해몽","dream reading; dream interpretation","","꿈에서 일어난 일에 대해 좋고 나쁨을 풀이함.",""
"해몽하다","read a dream; interpret a dream","","꿈에서 일어난 일에 대해 좋고 나쁨을 풀이하다.",""
"해묵다","be age-old; get old","","어떤 물건이 해를 넘겨 오래 남아 있다.",""
"해물","seafood","","바다에서 나는 모든 동식물.",""
"해물탕","haemultang","","여러 해산물을 넣고 국물을 약간 많이 부어 얼큰하게 끓인 음식.",""
"해바라기","sunflower","","높이는 2미터 정도이고, 늦여름에 피는 노랗고 둥글넓적한 큰 꽃.",""
"해박하다","knowledgeable; erudite; learned","","여러 방면으로 학식이 넓고 아는 것이 많다.",""
"해발","elevation; altitude; being above sea level","","바닷물의 표면으로부터 잰 육지나 산의 높이.",""
"해방","liberation; setting free; emancipation","","자유를 억압하는 것으로부터 벗어나게 함.",""
"해방감","sense of freedom","","자유를 억압하는 것으로부터 벗어난 느낌.",""
"해방되다","be liberated; be set free; be emancipated","","자유를 억압하는 것으로부터 벗어나다.",""
"해방둥이","child born in the year of the Liberation of Korea","","대한민국이 일본 제국주의로부터 해방된 1945년에 태어난 사람.",""
"해방하다","liberate; set free; emancipate","","자유를 억압하는 것으로부터 벗어나게 하다.",""
"해법","solution; answer; fix","","어렵거나 곤란한 일을 푸는 방법.",""
"해변","beach; coast; seaside; seashore","","바다와 육지가 맞닿은 곳이나 그 근처.",""
"해변가","beach; coast; seaside; seashore","","바다와 육지가 맞닿은 곳이나 그 근처.",""
"해병","marine","","해병대의 병사.",""
"해병대","marine corps","","바다와 땅 어디에서도 싸울 수 있도록 조직되고 훈련된 부대.",""
"해보다","try; take a chance; give it a go","","대들어 승부를 가리거나 싸우다.",""
"해부","anatomy; dissection","","생물체의 한 부분 또는 전부를 갈라 그 내부를 조사함.",""
"해부도","anatomical chart","","생물의 내부 구조를 자세하게 그린 그림.",""
"해부하다","anatomize; dissect","","생물체의 한 부분 또는 전부를 갈라 그 내부를 조사하다.",""
"해부학","anatomy","","생물의 내부 구조를 연구하는 학문.",""
"해빙","thawing; melting","","얼음이 녹음.",""
"해빙기","thaw","","얼음이 녹는 때.",""
"해빙되다","thaw; melt","","얼음이 녹게 되다.",""
"해빙하다","thaw; melt","","얼음이 녹다.",""
"해사하다","fair-faced; radiant; bright","","얼굴이 희고 곱다.",""
"해산","delivery; childbirth","","아이를 낳음.",""
"해산","dispersal; breakup","","모였던 사람들이 흩어짐. 또는 흩어지게 함.",""
"해산물","seafood","","바다에서 나는 동물과 식물.",""
"해산하다","deliver a baby","","아이를 낳다.",""
"해산하다","disperse; break up","","모였던 사람들이 흩어지다. 또는 흩어지게 하다.",""
"해삼","sea cucumber","","몸은 부드럽고 오이 모양으로 온몸에 오톨도톨한 돌기가 나 있는, 바다에 사는 동물.",""
"해상","being on the sea","","바다의 위.",""
"해석","interpretation; comprehension; explanation","","문장으로 표현된 내용을 이해하고 설명함. 또는 그 내용.",""
"해석되다","be interpreted; be comprehended; be explained","","문장으로 표현된 내용이 이해된 상태에서 설명되다.",""
"해석하다","interpret; comprehend; explain","","문장으로 표현된 내용을 이해하고 설명하다.",""
"해설","explanation; interpretation; commentary","","어려운 문제나 사건의 내용 등을 알기 쉽게 풀어 설명함. 또는 그런 글이나 책.",""
"해설되다","be explained; be interpreted","","어려운 문제나 사건의 내용 등이 알기 쉽게 풀려 설명되다.",""
"해설자","commentator; expositor","","어려운 문제나 사건의 내용 등을 알기 쉽게 풀어 설명하는 사람.",""
"해설하다","explain; interpret; comment","","어려운 문제나 사건의 내용 등을 알기 쉽게 풀어 설명하다.",""
"해소","resolution; relief; easing; release","","어려운 일이나 좋지 않은 상태를 해결하여 없애 버림.",""
"해소되다","be resolved; be relieved; be eased; be released","","어려운 일이나 좋지 않은 상태가 해결되어 없어지다.",""
"해소하다","resolve; relieve; ease; release","","어려운 일이나 좋지 않은 상태를 해결하여 없애 버리다.",""
"해수","sea water; salt water","","맛이 짜고 비릿한, 바다에 있는 물.",""
"해수면","sea surface; sea level","","바닷물의 표면.",""
"해수욕","sea bathing; playing in the sea","","바닷물에서 헤엄을 치며 놂.",""
"해수욕장","beach","","사람들이 바닷물에서 헤엄치고 놀 수 있도록 시설을 갖춘 바닷가.",""
"해시계","haesigye","","해가 떠 있는 동안 물체의 그림자 길이와 위치의 변화를 이용하여 시간을 재는 시계.",""
"해쓱하다","pale; lifeless; pasty","","얼굴에 핏기나 생기가 없고 창백하다.",""
"해악","evils; ills; mischief; harm","","남에게 해를 끼치는 나쁜 일.",""
"해안","coast; seaside; seashore","","바다와 육지가 맞닿은 곳.",""
"해안가","coast; seaside; seashore","","바다와 육지가 맞닿은 곳이나 그 근처.",""
"해안선","coastline; shoreline","","바다와 육지가 맞닿은 선.",""
"해약","cancellation; breach","","약속이나 계약 등이 깨짐. 또는 약속이나 계약 등을 깨뜨림.",""
"해약하다","cancel; breach","","약속이나 계약 등이 깨지다. 또는 약속이나 계약 등을 깨뜨리다.",""
"해양","ocean; sea","","태평양, 대서양, 인도양 등과 같이 넓고 큰 바다.",""
"해양성","being oceanic; being maritime","","바다가 가지는 특별한 성질.",""
"해어지다","wear out; be tattered; become shabby","","닳아서 구멍이 나거나 찢어지다.",""
"해역","waters; area of the ocean","","바다 위의 일정한 구역.",""
"해열","reducing fever; alleviation of fever","","몸의 열을 내림.",""
"해열제","fever reducer","","몸의 열을 내리게 하는 약.",""
